{
  "schema_version": "CBPR-002",
  "runtime_instance_id": "r1",
  "service_relationship_reference": "sr1",
  "runtime_profile": {
    "runtime_type": "sandbox",
    "version": "1",
    "isolation_model": "bounded"
  },
  "runtime_integrity_state": "VERIFIED_TO_DECLARED_SCOPE",
  "resource_budget": {
    "cpu_seconds": 60,
    "memory_mb": 128,
    "wall_clock_seconds": 120,
    "max_processes": 2,
    "max_network_bytes": 10000
  },
  "storage_mounts": [],
  "tool_permissions": [],
  "network_permissions": [
    {
      "mode": "NO_NETWORK",
      "destinations": []
    }
  ],
  "credential_bindings": [],
  "action_grants": [],
  "output_interfaces": [
    {
      "interface_id": "o1",
      "destination_reference": "local",
      "consequence_class": "PASSIVE_LOCAL_OUTPUT",
      "verification_state": "VERIFIED_TO_DECLARED_SCOPE"
    }
  ],
  "activation_policy": {
    "mode": "MANUAL",
    "expires_at": null,
    "temporal_evidence": {
      "claimed_time": "2026-10-02T09:00:00Z",
      "observed_time": "2026-10-02T09:00:00Z",
      "clock_source_reference": "clock-1",
      "trust_state": "VERIFIED_TO_DECLARED_SCOPE",
      "uncertainty_ms": 10
    }
  },
  "control_events": [],
  "composition_evaluations": [],
  "commit_validations": [
    {
      "validation_id": "cv",
      "action_proposal_reference": "a",
      "credential_current": "NOT_APPLICABLE",
      "grant_current": "NOT_APPLICABLE",
      "target_current": "PASS",
      "output_consequence_current": "PASS",
      "terms_policy_current": "PASS",
      "service_relationship_current": "PASS",
      "temporal_validity_current": "UNRESOLVED",
      "dependency_safety_current": "PASS",
      "required_approval_current": "NOT_APPLICABLE",
      "composition_current": "NOT_APPLICABLE",
      "result": "COMMITTABLE",
      "validated_at": "2026-10-02T09:01:00Z"
    }
  ],
  "current_state": "READY",
  "action_proposals": [
    {
      "action_proposal_id": "a",
      "operation": "write",
      "target_or_interface": "o1",
      "expected_consequence_class": "PASSIVE_LOCAL_OUTPUT",
      "credential_binding_reference": null,
      "action_grant_reference": null,
      "composition_evaluation_reference": null,
      "proposed_at": "2026-10-02T09:00:00Z",
      "expires_at": null,
      "operation_id": "x",
      "commit_state": "PROPOSED"
    }
  ],
  "provenance_events": []
}
